{"task_id":"M1-AGENT-002","outcome":"completed","dod_met":true,"summary":"Added an append-only StepRecord capturing validation outcome and timings, wired loop logging to record these fields, and updated run summaries to include history-derived counts. Notes updated for AGENT-002.","tests":{"ran":true,"commands":["cargo test -q"],"passed":false},"notes":"Test failures appear unrelated to this change:\n- browser::act::tests::resolve_backend_node_id_falls_back_to_parse\n- llm::router::tests::resets_counters_on_progress\n","blockers":[]}