{"task_id":"M2-PROGRESS-002","outcome":"completed","dod_met":true,"summary":"Added an actionability score (count + role weights) to flag low-actionability observations, log the signal, and drive router escalation via a dedicated low-actionability streak counter. Updated router tests and added a new low-actionability escalation test. Recorded the change in notes.","tests":{"ran":true,"commands":["cargo test -q router"],"passed":true},"notes":"Updated `src/llm/router.rs` with scoring, new counters, and tier logic. Wired `src/agent/loop.rs` to record heuristics and log actionability details. Added note `notes/2026-02-11-progress-003-low-actionability.md` and index entry.","blockers":[]}