{"task_id":"M1-CLI-002","outcome":"completed","dod_met":true,"summary":"Config now auto-loads from default file locations, env overrides still apply deterministically, and startup logs redact URL userinfo to avoid leaking secrets. README and notes updated to reflect the lookup order and env list.","tests":{"ran":false,"commands":[],"passed":false},"notes":"Changes made in `src/main.rs`, `README.md`, and notes. Added `notes/2026-02-11-cli-002-config-env-merge.md` and updated `notes/index.md`. No tests run.","blockers":[]}