{"task_id":"M3-BENCH-003","outcome":"completed","dod_met":true,"summary":"Per-task token usage is now captured at LLM call boundaries, stored per step, and aggregated into benchmark task results with explicit null/error handling for missing usage.","tests":{"ran":true,"commands":["cargo test -q"],"passed":false},"notes":"Changes include new TokenUsage/LlmResponse plumbing, OpenAI usage parsing, bench report/log usage fields, and updated tests; E2E tests failed due to Chromium singleton lock and one click assertion.","blockers":["E2E tests failed: Chromium singleton lock errors and one click outcome assertion."]}