{"task_id":"M3-BENCH-001","outcome":"completed","dod_met":true,"summary":"Bench now accepts LLM mode via CLI/config, respects scripted vs openai at runtime, and no longer forces scripted; docs and notes updated.","tests":{"ran":false,"commands":[],"passed":false},"notes":"Changes in `src/main.rs`, `README.md`, `notes/2026-02-11-bench-llm-mode.md`, and `notes/index.md`.","blockers":[]}