{"task_id":"M0-CDP-003","outcome":"completed","dod_met":true,"summary":"Snapshot now pulls AX tree, filters interactive roles, and emits ElementRef role/name metadata; e2e harness asserts >=10 actionable nodes; notes and PRD task status updated.","tests":{"ran":true,"commands":["cargo test e2e_snapshot_actionable_nodes"],"passed":true},"notes":"Key files updated: src/browser/observe.rs, tests/e2e.rs, prd.json, notes/2026-02-11-cdp-003-accessibility-actionable.md, notes/index.md.","blockers":[]}