{"task_id":"M0-SCHEMA-003","outcome":"completed","dod_met":true,"summary":"Added malformed action payload tests for strict OpenAI parsing (invalid_json/schema_violation) and scripted parsing (invalid_actions), plus a new note and index entry. Targeted tests passed.","tests":{"ran":true,"commands":["cargo test rejects_malformed_actions_with_parse_code","cargo test parse_strict_reports"],"passed":true},"notes":"Edits in `src/llm/openai.rs`, `src/llm/scripted.rs`, `notes/2026-02-11-m0-schema-003-malformed-action-tests.md`, `notes/index.md`.","blockers":[]}