{"task_id":"M3-BENCH-002","outcome":"completed","dod_met":true,"summary":"Added a shared benchmark gate evaluation function, included explicit gate outcome in the bench report artifact, and added tests covering gate evaluation and step-limit enforcement. Updated notes index with a new bench gate checks note.","tests":{"ran":false,"commands":[],"passed":false},"notes":"Changes are in `src/bench.rs`, `src/main.rs`, `notes/2026-02-11-bench-002-gate-checks.md`, and `notes/index.md`. Tests not run.","blockers":[]}