{"task_id":"M1-BROW-008","outcome":"completed","dod_met":true,"summary":"Implemented a no-history guard for Back actions by checking history length and returning a structured ActionError when there is no previous entry. Added a note describing the behavior and indexed it.","tests":{"ran":false,"commands":[],"passed":false},"notes":"Changes in `src/browser/act.rs` add a history length check and structured error; notes updated in `notes/2026-02-11-brow-008-back-exec.md` and `notes/index.md`.","blockers":[]}