{"task_id":"M1-OBSERV-002","outcome":"completed","dod_met":true,"summary":"Added LLM metric emission for duration and failure counters with structured error-code tagging. Failures now increment per-code counts and emit `llm_failures_total` metric events; LLM durations emit `llm_duration_ms` events. OpenAI adapter now reports failure codes through telemetry. Added a note documenting the change.","tests":{"ran":false,"commands":[],"passed":false},"notes":"Files updated: `src/telemetry.rs`, `src/llm/openai.rs`, `notes/2026-02-11-observ-002-llm-metrics.md`, `notes/index.md`. No tests were run." ,"blockers":[]}