{"task_id":"M1-CORE-001","outcome":"completed","dod_met":true,"summary":"Moved JSON repair into the LLM module to eliminate the llm↔verify cycle; updated imports and module exports; added a note documenting the boundary change.","tests":{"ran":true,"commands":["cargo test -q"],"passed":false},"notes":"`cargo test -q` failed in `tests/e2e.rs` because Chromium could not launch due to an existing SingletonLock (cdp_launch_failed). Unit and non-e2e tests passed.","blockers":[]}