{"task_id":"M1-VALID-001","outcome":"completed","dod_met":true,"summary":"Validation failures now carry a machine-readable validation code, and the validator already enforces id presence against the current observation. Added `StepError.validation_code` and wired it in the agent validator error path, with a new note in the index.","tests":{"ran":true,"commands":["cargo test -q --lib"],"passed":false},"notes":"Test failure is pre-existing/unrelated: `browser::act::tests::resolve_backend_node_id_falls_back_to_parse` fails because `resolve_backend_node_id` returns `stale_element` when given an empty map." ,"blockers":["`cargo test -q --lib` failed in `src/browser/act.rs` test: `resolve_backend_node_id_falls_back_to_parse` (map empty returns `stale_element`)."]}