{"task_id":"M2-PROGRESS-001","outcome":"completed","dod_met":true,"summary":"Added explicit loop state for repeated state hash streaks, wired it into router outcomes and early termination, and introduced a NoProgress run status with config/CLI/env support. Added test coverage and updated notes.","tests":{"ran":true,"commands":["cargo test"],"passed":false},"notes":"cargo test failures are limited to e2e tests that could not launch Chromium due to an existing SingletonLock (cdp_launch_failed). Unit/integration tests passed.\n\nKey changes:\n- Loop state and termination: src/agent/loop.rs\n- Policy/config/CLI/env: src/agent/policy.rs, src/config.rs, src/main.rs\n- NoProgress status in output/bench: src/output.rs, src/bench.rs\n- Router step_outcome signature and tests: src/llm/router.rs\n- Test fix for backend id fallback behavior: src/browser/act.rs\n- Notes: notes/2026-02-11-progress-002-hash-streak.md, notes/index.md\n\nUnexpected repo state:\n- git status shows modified prd.json and new .ralph/runs/M2-PROGRESS-001/ which I did not touch. Let me know if you want me to ignore, inspect, or revert those.","blockers":["e2e tests failing to launch Chromium due to existing profile SingletonLock; rerun after clearing/serializing Chromium runs"]}