{"task_id":"M0-CDP-002","outcome":"completed","dod_met":true,"summary":"Added an e2e test that asserts snapshot URL/title match the harness page and viewport dimensions are non-zero, confirming CDP-populated metadata. Documented the outcome in notes.","tests":{"ran":true,"commands":["cargo test e2e_snapshot_metadata --test e2e"],"passed":true},"notes":"Changes in tests/e2e.rs and notes/2026-02-11-cdp-002-snapshot-metadata.md; index updated in notes/index.md.","blockers":[]}