{"task_id":"M1-VALID-002","outcome":"completed","dod_met":true,"summary":"Added boundary unit coverage for type text length validation and recorded the work in notes. `Validator` already enforced the max length; tests now assert max is accepted and max+1 is rejected with `text_too_long`.","tests":{"ran":true,"commands":["cargo test validates_text_at_max_length","cargo test rejects_text_above_max_length"],"passed":true},"notes":"Changes in `src/verify/rules.rs`, `notes/2026-02-11-valid-002-type-text-length.md`, and `notes/index.md`.","blockers":[]}