{"task_id":"M1-BROW-003","outcome":"completed","dod_met":true,"summary":"Click execution now resolves ids strictly against the latest observation map and maps detached/stale CDP node failures to a structured `stale_element` error; added a unit test and documented the behavior.","tests":{"ran":true,"commands":["cargo test resolve_backend_node_id_requires_latest_map_entry"],"passed":false},"notes":"The test failed due to a pre-existing Tokio `Unpin` issue in `src/browser/cdp.rs:121`, unrelated to the changes here.","blockers":[] }