{"task_id":"M1-HARNESS-003","outcome":"completed","dod_met":true,"summary":"Added dedicated integration tests for select, scroll, and wait, including success and bounded-constraint failures; added a scroll spacer to the harness page; documented the change in notes.","tests":{"ran":false,"commands":[],"passed":false},"notes":"Changes in `tests/e2e.rs`, `harness/pages/actions.html`, `notes/2026-02-11-harness-003-select-scroll-wait-integration.md`, `notes/index.md`. Tests not run here.","blockers":[]}