{"task_id":"M2-REPAIR-001","outcome":"completed","dod_met":true,"summary":"Implemented a narrower, deterministic JSON repair pass that triggers on invalid JSON, schema violations, and multi-action wrappers while preserving original error context; tightened array unwrapping to single-item only, expanded OpenAI parsing tests, and documented the change in notes.","tests":{"ran":true,"commands":["cargo test -q repair"],"passed":false},"notes":"Test run failed due to a pre-existing Clap parser issue in `src/main.rs:54` (`value_parser!(usize).range(1..)`) which is unrelated to the JSON repair changes.","blockers":[]}